cord_uid,title,abstract,journal,publish_time,authors,url,source_x
qwerty123,"COVID-19 Transmission Dynamics in Urban Settings","This study examines how COVID-19 spreads in densely populated urban areas, focusing on public transportation and shared spaces. Our findings suggest that mask mandates significantly reduce transmission rates in these environments.","Journal of Urban Health","2020-08-15","Smith J, Johnson A, Williams R","https://example.com/paper1","PMC"
asdfgh456,"SARS-CoV-2 Vaccine Efficacy in Elderly Populations","We conducted a randomized controlled trial to evaluate vaccine effectiveness in patients over 65 years old. Results show 92% efficacy after the second dose with minimal side effects.","New England Journal of Medicine","2021-02-20","Brown K, Davis M, Miller T","https://example.com/paper2","WHO"
zxcvbn789,"Long COVID: Symptoms and Rehabilitation Strategies","This paper analyzes persistent symptoms in COVID-19 survivors and proposes evidence-based rehabilitation protocols. Fatigue and respiratory issues were most common.","The Lancet","2021-05-10","Wilson P, Anderson L, Thomas S","https://example.com/paper3","CZI"
poiuyt098,"Impact of School Closures on COVID-19 Spread","We modeled the epidemiological impact of school closures during the pandemic. While effective initially, long-term closures showed diminishing returns on infection control.","Science","2020-11-30","Roberts D, White H, Clark J","https://example.com/paper4","NIH"
lkjhgf765,"Economic Consequences of Pandemic Lockdown Measures","This economic analysis examines the trade-offs between public health measures and economic impacts across different countries and socioeconomic groups.","Nature Economics","2021-01-25","Martinez R, Chen W, Kim Y","https://example.com/paper5","PMC"
mnbvcx321,"Mental Health During COVID-19 Lockdowns","A longitudinal study of mental health indicators during various lockdown phases, showing increased anxiety and depression rates, particularly among young adults.","JAMA Psychiatry","2020-12-08","Patel S, O'Brien K, Lee M","https://example.com/paper6","WHO"
qazwsx234,"Remote Learning Effectiveness During Pandemic","Assessment of educational outcomes across different remote learning modalities, highlighting challenges and successes in various demographic groups.","Education Research","2021-03-17","Garcia L, Thompson B, Wilson C","https://example.com/paper7","CZI"
edcrfv567,"Healthcare Worker Burnout During COVID-19","Survey results from frontline healthcare workers showing alarming rates of burnout, with recommendations for institutional support systems.","BMJ","2021-04-05","Nguyen T, Rodriguez P, Kumar S","https://example.com/paper8","NIH"
tgbyhn678,"Air Quality Improvements During Lockdown","Analysis of global air pollution data during lockdown periods, showing significant temporary improvements in air quality across major cities.","Environmental Science","2020-10-12","Wang X, Singh A, Costa R","https://example.com/paper9","PMC"
yhnujm890,"Vaccine Hesitancy: Causes and Interventions","Mixed-methods study exploring reasons for vaccine hesitancy and testing various communication strategies to increase vaccination uptake.","Public Health","2021-06-30","Jackson D, Murphy E, Fisher B","https://example.com/paper10","WHO"
ikmjun123,"Telemedicine Adoption During Pandemic","Rapid adoption patterns of telemedicine services, barriers to access, and patient satisfaction across different healthcare systems.","Health Affairs","2020-09-22","Lewis C, Parker G, Wright D","https://example.com/paper11","CZI"
olpkij456,"COVID-19 Variants and Vaccine Efficacy","Laboratory study examining how existing vaccines perform against emerging variants of concern, with recommendations for booster strategies.","Cell","2021-07-15","Yamamoto H, Silva R, Beckerman M","https://example.com/paper12","NIH"
qscwdv789,"Supply Chain Resilience During Pandemic","Case studies of supply chain disruptions and adaptive strategies across various industries during the COVID-19 pandemic.","Operations Research","2021-01-10","Anderson T, Robinson L, Park J","https://example.com/paper13","PMC"
axdcfv098,"Social Distancing Effectiveness: Meta-analysis","Systematic review and meta-analysis of studies measuring the effectiveness of social distancing measures in reducing COVID-19 transmission.","Epidemiology","2020-12-01","Mitchell R, Cooper D, Hayes S","https://example.com/paper14","WHO"
plmokn321,"Antiviral Drug Development for COVID-19","Progress report on development and testing of antiviral medications, including mechanism of action studies and clinical trial results.","Nature Medicine","2021-02-28","Zhang L, O'Connell M, Vargas K","https://example.com/paper15","CZI"
qwerty456,"Pandemic Response: Comparative Analysis","Cross-country comparison of COVID-19 response strategies, outcomes, and lessons learned for future pandemic preparedness.","Global Health","2021-05-20","Schmidt F, Ito N, Benitez C","https://example.com/paper16","NIH"
asdfgh789,"COVID-19 in Pediatric Populations","Clinical characteristics, transmission patterns, and outcomes of COVID-19 infection in children across different age groups.","Pediatrics","2020-11-05","Rivera M, Thompson P, Evans D","https://example.com/paper17","PMC"
zxcvbn012,"Workplace Safety Protocols Evaluation","Effectiveness study of various workplace safety measures including ventilation improvements, distancing, and protective equipment.","Occupational Health","2021-03-08","Green E, Martinez S, Wilson P","https://example.com/paper18","WHO"
poiuyt321,"Economic Stimulus Package Analysis","Impact assessment of various economic stimulus measures implemented during the pandemic across different countries.","Economic Policy","2021-04-15","Davis R, Chen L, O'Malley K","https://example.com/paper19","CZI"
lkjhgf012,"Public Health Communication Strategies","Analysis of effective public health messaging during the pandemic, including cultural considerations and media platform effectiveness.","Health Communication","2020-10-30","Kim J, Anderson B, Wright T","https://example.com/paper20","NIH"
